,Authors,Lead sentences,Lemm Analysis,Lemmatized lead sentences,Publish Date,Title,URL
54,"Kommersant, Вероника Горячева","Угроза отзыва лицензий сразу у нескольких банков региона вынудила власти Татарстана пойти на беспрецедентные меры. Как стало известно ""Ъ"", правительство республики договорилось с местным управлением налоговой службы и отделениями внебюджетных фондов о том, что налоги и взносы, которые зависли в проблемных банках, будут считаться уплаченными. Подобные решения противоречат сложившейся судебной практике, механизм администрирования в столь крупных масштабах неясен, а легитимность — спорна. Но в Татарстане рассчитывают сделать эти меры массовыми. Возможно, вопрос будет поднят уже сегодня на встрече экс-президента Татарстана Минтимера Шаймиева с Владимиром Путиным.","S,жен,неод=им,ед S,муж,неод=род,ед S,жен,неод=род,мн ADV= NUM=(|пр|род|вин,од) S,муж,неод=род,мн S,муж,неод=род,ед V=прош,ед,изъяв,жен,сов S,жен,неод=(пр,ед|вин,мн|дат,ед|род,ед|им,мн) S,гео,муж,неод=род,ед V,сов,нп=инф A=(вин,мн,полн,неод|им,мн,полн) S,жен,неод=(вин,мн|род,ед|им,мн) ADVPRO= V,нп=прош,ед,изъяв,сред,сов ADV,прдк= S,сред,неод=(вин,ед|им,ед) S,жен,неод=(вин,мн|род,ед|им,мн) V,нп=прош,ед,изъяв,сред,сов A=(дат,мн,полн|твор,ед,полн,муж|твор,ед,полн,сред) S,сред,неод=твор,ед A=(пр,ед,полн,жен|дат,ед,полн,жен|род,ед,полн,жен|твор,ед,полн,жен) S,жен,неод=(вин,мн|род,ед|им,мн) S,сред,неод=твор,мн A=(пр,мн,полн|вин,мн,полн,од|род,мн,полн) S,муж,неод=род,мн S,муж,неод=(вин,мн|им,мн) S,муж,неод=(вин,мн|им,мн) APRO=(им,мн|вин,мн,неод) V,нп=прош,мн,изъяв,сов A=(пр,мн,полн|вин,мн,полн,од|род,мн,полн) S,муж,неод=пр,мн V,нп=непрош,мн,изъяв,3-л V,несов,нп=инф V,пе=прош,твор,мн,прич,полн,сов,страд A=(вин,мн,полн,неод|им,мн,полн) S,сред,неод=(вин,мн|род,ед|им,мн) V,несов,нп=непрош,мн,изъяв,3-л V,нп=(прош,пр,ед,прич,полн,жен,сов,действ|прош,дат,ед,прич,полн,жен,сов,действ|прош,род,ед,прич,полн,жен,сов,действ|прош,твор,ед,прич,полн,жен,сов,действ) A=(пр,ед,полн,жен|дат,ед,полн,жен|род,ед,полн,жен|твор,ед,полн,жен) S,жен,неод=(пр,ед|дат,ед) S,муж,неод=(вин,ед|им,ед) S,сред,неод=(вин,мн|род,ед|им,мн) ADVPRO= A=(пр,мн,полн|вин,мн,полн,од|род,мн,полн) S,муж,неод=пр,мн A=ед,кр,муж S,жен,неод=(вин,ед|им,ед) A=ед,кр,жен CONJ= S,гео,муж,неод=пр,ед V,несов,пе=непрош,мн,изъяв,3-л V,сов,пе=инф S,жен,неод=(вин,мн|род,ед|им,мн) A=твор,мн,полн ADV,прдк= S,муж,неод=(вин,ед|им,ед) V=прош,ед,прич,кр,муж,сов,страд ADV= S,жен,неод=(пр,ед|дат,ед) S,муж,од=(вин,ед|род,ед) S,гео,муж,неод=род,ед S,имя,муж,од=(вин,ед|род,ед) S,фам,муж,од=(вин,ед|род,ед) S,имя,муж,од=твор,ед S,фам,муж,од=(дат,мн|твор,ед) ","угроза отзыв лицензия сразу несколько банк регион вынуждать власть татарстан пойти беспрецедентный мера как становиться известно Ъ правительство республика договариваться местный управление налоговый служба отделение внебюджетный фонд налог взнос который зависать проблемный банк быть считаться уплачивать подобный решение противоречить складываться судебный практика механизм администрирование столь крупный масштаб неясный легитимность спорный но татарстан рассчитывать сделать мера массовый возможно вопрос подымать сегодня встреча экспрезидент татарстан минтимер шаймиев владимир путин
",2017-01-19T00:00:00+03:00,Татарстан нашел новый способ поддержки клиентов проблемных банков,https://www.kommersant.ru/doc/3195708
55,"Kommersant, Иван Буранов","Число эвакуаций на штрафстоянки в Москве снизилось за прошедший год на 6%. Уменьшилось и количество нарушений правил парковки. В мэрии Москвы считают, что водители стали дисциплинированнее. Дело не в дисциплине, возражают независимые эксперты: перемещать больше машин, чем сейчас, столичная система эвакуации просто не в состоянии, а количество брошенных на штрафстоянках машин растет.","S,сред,неод=(вин,ед|им,ед) S,жен,неод=род,мн S,жен,неод=(вин,мн|род,ед|им,мн) S,гео,жен,неод=(пр,ед|дат,ед) V,нп=прош,ед,изъяв,сред,сов V,нп=(прош,вин,ед,прич,полн,муж,сов,действ,неод|прош,им,ед,прич,полн,муж,сов,действ) S,муж,неод=(вин,ед|им,ед) V,нп=прош,ед,изъяв,сред,сов S,сред,неод=(вин,ед|им,ед) S,сред,неод=род,мн S,сред,неод=род,мн S,жен,неод=(вин,мн|род,ед|им,мн) S,сокр=(пр,мн|пр,ед|вин,мн|вин,ед|дат,мн|дат,ед|род,мн|род,ед|твор,мн|твор,ед|им,мн|им,ед) S,жен,неод=(пр,ед|вин,мн|дат,ед|род,ед|им,мн) S,гео,жен,неод=(вин,мн|род,ед|им,мн) V,несов,пе=непрош,мн,изъяв,3-л S,муж,од=им,мн V,нп=прош,мн,изъяв,сов A=срав S,сред,неод=(вин,ед|им,ед) S,жен,неод=(пр,ед|дат,ед) V,нп=непрош,мн,изъяв,3-л,несов A=(вин,мн,полн,неод|им,мн,полн) S,муж,од=им,мн V=инф,несов,пе S,жен,неод=род,мн A=им,ед,полн,жен S,жен,неод=им,ед S,жен,неод=(пр,ед|вин,мн|дат,ед|род,ед|им,мн) PART= S,сред,неод=пр,ед S,сред,неод=(вин,ед|им,ед) V=(прош,пр,мн,прич,полн,сов,страд|прош,вин,мн,прич,полн,сов,страд,од|прош,род,мн,прич,полн,сов,страд) S,жен,неод=пр,мн S,жен,неод=род,мн V,несов,нп=непрош,ед,изъяв,3-л ","число эвакуация штрафстоянка москва снижаться прошедший год уменьшаться количество нарушение правило парковка в мэрия москва считать водитель становиться дисциплинированный дело дисциплина возражать независимый эксперт перемещать машина столичный система эвакуация просто состояние количество бросать штрафстоянка машина расти
",2017-01-19T00:00:00+03:00,У московских штрафстоянок становится меньше клиентов,https://www.kommersant.ru/doc/3195645
56,"Kommersant, Виталий Гайдаев","Стоимость североморской нефти Brent вернулась к уровню ниже $55 за баррель. На сырьевой рынок негативно влияют прогнозы по наращиванию объемов добычи сланцевой нефти в США. Вопреки высокой зависимости от цен на нефть российская валюта удерживается ниже уровня 60 руб./$, чему способствуют высокий спрос на рубли со стороны иностранных инвесторов. Укрепление российской валюты не в интересах национальной экономики, но пока рублевая стоимость нефти остается на комфортном для бюджета уровне.","S,жен,неод=(вин,ед|им,ед) A=(пр,ед,полн,жен|дат,ед,полн,жен|род,ед,полн,жен|твор,ед,полн,жен) S,жен,неод=(пр,ед|вин,мн|дат,ед|род,ед|им,мн) V,сов,нп=прош,ед,изъяв,жен S,муж,неод=дат,ед ADV= S,муж,неод=(вин,ед|им,ед) PR= A=(вин,ед,полн,муж,неод|им,ед,полн,муж|пр,ед,полн,жен|дат,ед,полн,жен|род,ед,полн,жен|твор,ед,полн,жен) S,муж,неод=(вин,ед|им,ед) ADV= V,несов,нп=непрош,мн,изъяв,3-л S,муж,неод=(вин,мн|им,мн) S,сред,неод=дат,ед S,муж,неод=род,мн S,жен,неод=(вин,мн|род,ед|им,мн) A=(пр,ед,полн,жен|дат,ед,полн,жен|род,ед,полн,жен|твор,ед,полн,жен) S,жен,неод=(пр,ед|вин,мн|дат,ед|род,ед|им,мн) S,сокр,гео,мн,неод=(пр|вин|дат|род|твор|им) PR= A=(пр,ед,полн,жен|дат,ед,полн,жен|род,ед,полн,жен|твор,ед,полн,жен) S,жен,неод=(пр,ед|вин,мн|дат,ед|род,ед|им,мн) S,жен,неод=род,мн S,жен,неод=(вин,ед|им,ед) A=им,ед,полн,жен S,жен,неод=им,ед V,нп=непрош,ед,изъяв,3-л,несов ADV= S,муж,неод=род,ед SPRO,ед,сред,неод=дат V,несов,нп=непрош,мн,изъяв,3-л A=(вин,ед,полн,муж,неод|им,ед,полн,муж) S,муж,неод=(вин,ед|им,ед) S,муж,неод=(вин,мн|им,мн) S,жен,неод=(вин,мн|род,ед|им,мн) A=(пр,мн,полн|вин,мн,полн,од|род,мн,полн) S,муж,од=(вин,мн|род,мн) S,сред,неод=(вин,ед|им,ед) A=(пр,ед,полн,жен|дат,ед,полн,жен|род,ед,полн,жен|твор,ед,полн,жен) S,жен,неод=(вин,мн|род,ед|им,мн) S,муж,неод=пр,мн A=(пр,ед,полн,жен|дат,ед,полн,жен|род,ед,полн,жен|твор,ед,полн,жен) S,жен,неод=(вин,мн|род,ед|им,мн) ADV= A=им,ед,полн,жен S,жен,неод=(вин,ед|им,ед) S,жен,неод=(пр,ед|вин,мн|дат,ед|род,ед|им,мн) V,нп=непрош,ед,изъяв,3-л,несов A=(пр,ед,полн,муж|пр,ед,полн,сред) S,муж,неод=род,ед S,муж,неод=пр,ед ","стоимость североморский нефть Brent вернуться уровень ниже баррель на сырьевой рынок негативно влиять прогноз наращивание объем добыча сланцевый нефть сша вопреки высокий зависимость цена нефть российский валюта удерживаться низко уровень что способствовать высокий спрос рубль сторона иностранный инвестор укрепление российский валюта интерес национальный экономика пока рублевый стоимость нефть оставаться комфортный бюджет уровень
",2017-01-19T00:00:00+03:00,Для российского бюджета,https://www.kommersant.ru/doc/3195629
57,"Kommersant, Юлия Полякова, Светлана Самусева","Как стало известно ""Ъ"", сразу несколько крупных банков готовят письмо на имя председателя ЦБ Эльвиры Набиуллиной с просьбой не вводить обязательное требование по переводу всех бюджетных средств, включая зарплаты, пенсии и оплату больничных листов, на карту ""Мир"". Среди аргументов — противоречие таких требований антимонопольному законодательству и разрушение сложившейся платежной инфраструктуры. Кроме того, опасаются эксперты, данная инициатива ограничит возможности граждан по использованию собственных средств.","ADVPRO= V,нп=прош,ед,изъяв,сред,сов ADV,прдк= ADV= ADV= A=(пр,мн,полн|вин,мн,полн,од|род,мн,полн) S,муж,неод=род,мн V,несов,пе=непрош,мн,изъяв,3-л S,сред,неод=(вин,ед|им,ед) S,сред,неод=(вин,ед|им,ед) S,муж,од=(вин,ед|род,ед) S,сред,неод=(пр,мн|пр,ед|вин,мн|вин,ед|дат,мн|дат,ед|род,мн|род,ед|твор,мн|твор,ед|им,мн|им,ед) S,имя,жен,од=(род,ед|им,мн) S,фам,жен,од=(пр,ед|дат,ед|род,ед|твор,ед) S,жен,неод=твор,ед V=инф,несов,пе A=(вин,ед,полн,сред|им,ед,полн,сред) S,сред,неод=(вин,ед|им,ед) S,муж,неод=дат,ед A=(пр,мн,полн|вин,мн,полн,од|род,мн,полн) S,сред,неод=род,мн PR= S,жен,неод=(вин,мн|род,ед|им,мн) S,жен,неод=(пр,ед|вин,мн|дат,ед|род,ед|им,мн) S,жен,неод=вин,ед A=(пр,мн,полн|вин,мн,полн,од|род,мн,полн) S,муж,неод=род,мн S,жен,неод=вин,ед S,муж,неод=(вин,ед|им,ед) PR= S,муж,неод=род,мн S,сред,неод=(вин,ед|им,ед) APRO=(пр,мн|род,мн|вин,мн,од) S,сред,неод=род,мн A=(дат,ед,полн,муж|дат,ед,полн,сред) S,сред,неод=дат,ед S,сред,неод=(вин,ед|им,ед) V,нп=(прош,пр,ед,прич,полн,жен,сов,действ|прош,дат,ед,прич,полн,жен,сов,действ|прош,род,ед,прич,полн,жен,сов,действ|прош,твор,ед,прич,полн,жен,сов,действ) A=(пр,ед,полн,жен|дат,ед,полн,жен|род,ед,полн,жен|твор,ед,полн,жен) S,жен,неод=(вин,мн|род,ед|им,мн) PR= V,несов,нп=непрош,мн,изъяв,3-л S,муж,од=им,мн A,полн=им,ед,жен S,жен,неод=им,ед V,пе=непрош,ед,изъяв,3-л,сов S,жен,неод=(пр,ед|вин,мн|дат,ед|род,ед|им,мн) S,муж,од=(вин,мн|род,мн) S,сред,неод=дат,ед A=(пр,мн,полн|вин,мн,полн,од|род,мн,полн) S,сред,неод=род,мн ","как становиться известно Ъ сразу несколько крупный банк готовить письмо имя председатель цб эльвира набиуллина просьба вводить обязательный требование перевод бюджетный средство включая зарплата пенсия оплата больничный лист карта мир среди аргумент противоречие такой требование антимонопольный законодательство разрушение складываться платежный инфраструктура кроме опасаться эксперт данный инициатива ограничивать возможность гражданин использование собственный средство
",2017-01-19T00:00:00+03:00,Участники рынка выступили против монополии,https://www.kommersant.ru/doc/3195627
58,"Kommersant, Юлия Локшина","Как стало известно ""Ъ"", менеджменту банка ""Глобэкс"" поручено в ближайшее время разработать ""перечень мер по повышению эффективности"". Это довольно неожиданный шаг с учетом заявлений ВЭБа о том, что на его банки есть очередь покупателей. Впрочем, скорее всего, в отличие от другого ""дочернего"" банка ВЭБа — Связь-банка — желающих купить ""Глобэкс"" не находится, и акционер пытается что-то предпринять для повышения привлекательности своего актива.","ADVPRO= V,нп=прош,ед,изъяв,сред,сов ADV,прдк= S,муж,неод=дат,ед S,жен,неод=им,ед S,жен,од=(пр,мн|пр,ед|вин,мн|вин,ед|дат,мн|дат,ед|род,мн|род,ед|твор,мн|твор,ед|им,мн|им,ед) V,пе=прош,ед,прич,кр,сред,сов,страд A=(вин,ед,полн,прев,сред|им,ед,полн,прев,сред) S,сред,неод=(вин,ед|им,ед) V,пе=инф,сов S,муж,неод=(вин,ед|им,ед) S,жен,неод=род,мн S,сред,неод=дат,ед S,жен,неод=(пр,ед|вин,мн|дат,ед|род,ед|им,мн) SPRO,ед,сред,неод=(вин|им) ADV= A=(вин,ед,полн,муж,неод|им,ед,полн,муж) S,муж,неод=(вин,ед|им,ед) S,муж,неод=твор,ед S,сред,неод=род,мн S,муж,неод=род,ед S,муж,неод=(вин,мн|им,мн) S,жен,неод=(вин,ед|им,ед) S,муж,од=(вин,мн|род,мн) CONJ,вводн= ADV=срав S,сред,неод=(вин,ед|им,ед) APRO=(вин,ед,муж,од|род,ед,муж|род,ед,сред) A=(вин,ед,полн,муж,од|род,ед,полн,муж|род,ед,полн,сред) S,жен,неод=им,ед S,муж,неод=род,ед S,жен,од=им,ед S,муж,од=(пр,мн|вин,мн|род,мн) V,сов,пе=инф S,жен,од=(пр,мн|пр,ед|вин,мн|вин,ед|дат,мн|дат,ед|род,мн|род,ед|твор,мн|твор,ед|им,мн|им,ед) V,нп=непрош,ед,изъяв,3-л,несов S,муж,од=им,ед V,несов,нп=непрош,ед,изъяв,3-л S,имя,муж,од=(пр,мн|пр,ед|вин,мн|вин,ед|дат,мн|дат,ед|род,мн|род,ед|твор,мн|твор,ед|им,мн|им,ед) V=инф,сов S,сред,неод=(вин,мн|род,ед|им,мн) S,жен,неод=(пр,ед|вин,мн|дат,ед|род,ед|им,мн) APRO=(вин,ед,муж,од|род,ед,муж|род,ед,сред) S,муж,неод=род,ед ","как становиться известно Ъ менеджмент банк глобэкс поручать близкий время разрабатывать перечень мера повышение эффективность это довольно неожиданный шаг учет заявление вэб банка очередь покупатель впрочем скоро отличие другой дочерний банк вэб связьбанк желать купить глобэкс находиться акционер пытаться чтото предпринимать повышение привлекательность свой актив
",2017-01-19T00:00:00+03:00,"""Глобэкс"" поработает над эффективностью",https://www.kommersant.ru/doc/3195588
59,"Kommersant, Александра Мерцалова","Возвращение на массовый рынок организованного туризма Турции резко изменило структуру спроса. На этапе раннего бронирования эта страна стала наиболее популярным направлением, вытеснив с первого места туры по России и аккумулировав до 50% продаж туроператоров. Спрос на классические европейские направления также демонстрирует уверенный рост, а внутренний рынок, напротив, входит в стагнацию.","S,сред,неод=(вин,ед|им,ед) A=(вин,ед,полн,муж,неод|им,ед,полн,муж) S,муж,неод=(вин,ед|им,ед) A=(вин,ед,полн,муж,од|род,ед,полн,муж|род,ед,полн,сред) S,муж,неод=род,ед S,гео,жен,неод=(пр,ед|вин,мн|дат,ед|род,ед|им,мн) ADV= V,пе=прош,ед,изъяв,сред,сов S,жен,неод=вин,ед S,муж,неод=род,ед PR= S,муж,неод=пр,ед A=(вин,ед,полн,муж,од|род,ед,полн,муж|род,ед,полн,сред) S,сред,неод=(вин,мн|род,ед|им,мн) APRO=им,ед,жен S,жен,неод=им,ед V,нп=прош,ед,изъяв,жен,сов ADV= A=(дат,мн,полн|твор,ед,полн,муж|твор,ед,полн,сред) S,сред,неод=твор,ед V,пе=прош,деепр,сов ANUM=(вин,ед,муж,од|род,ед,муж|род,ед,сред) S,сред,неод=(вин,мн|род,ед|им,мн) S,муж,неод=(вин,мн|им,мн) S,гео,жен,неод=(пр,ед|вин,мн|дат,ед|род,ед|им,мн) V,пе=(прош,деепр,несов|прош,деепр,сов) S,жен,неод=род,мн S,муж,неод=род,мн S,муж,неод=(вин,ед|им,ед) A=(вин,мн,полн,неод|им,мн,полн) A=(вин,мн,полн,неод|им,мн,полн) S,сред,неод=(вин,мн|род,ед|им,мн) ADV= V,несов,пе=непрош,ед,изъяв,3-л A=(вин,ед,полн,муж,неод|им,ед,полн,муж) S,муж,неод=(вин,ед|им,ед) A=(вин,ед,полн,муж,неод|им,ед,полн,муж) S,муж,неод=(вин,ед|им,ед) ADV,вводн= V,нп=непрош,ед,изъяв,3-л,несов S,жен,неод=вин,ед ","возвращение массовый рынок организованный туризм турция резко изменять структура спрос на этап ранний бронирование этот страна становиться наиболее популярный направление вытеснять первый место тур россия аккумулировать продажа туроператор спрос классический европейский направление также демонстрировать уверенный рост внутренний рынок напротив входить стагнация
",2017-01-19T00:00:00+03:00,Направление стало популярным в программах раннего бронирования,https://www.kommersant.ru/doc/3195594
