,Authors,Lead sentences,Lemm Analysis,Lemmatized lead sentences,Publish Date,Title,URL
27,"Kommersant, АЛЕКСЕЙ ПОТАПОВ, UFG Wealth Management","Избрание президентом Дональда Трампа стало главным событием последних трех месяцев ушедшего года. Несмотря на негативные ожидания, оно повлекло новую волну роста на фондовых рынках, а вот рынки облигаций снизились. В наступившем году деятельность эксцентричного миллиардера, вероятно, станет главным, на что надо будет обращать внимание игрокам фондового рынка.","S,сред,неод=(вин,ед|им,ед) S,муж,од=твор,ед S,имя,муж,од=(вин,ед|род,ед) S,муж,неод=род,ед V,нп=прош,ед,изъяв,сред,сов A=(дат,мн,полн|твор,ед,полн,муж|твор,ед,полн,сред) S,сред,неод=твор,ед A=(пр,мн,полн|вин,мн,полн,од|род,мн,полн) NUM=(пр|род|вин,од) S,муж,неод=род,мн V,нп=(прош,вин,ед,прич,полн,муж,сов,действ,од|прош,род,ед,прич,полн,муж,сов,действ|прош,род,ед,прич,полн,сред,сов,действ) S,муж,неод=(вин,мн|род,ед|им,мн) ADV= A=(вин,мн,полн,неод|им,мн,полн) S,сред,неод=(вин,мн|род,ед|им,мн) SPRO,ед,3-л,сред=им V,сов,пе=прош,ед,изъяв,сред A=вин,ед,полн,жен S,жен,неод=вин,ед S,муж,неод=(вин,мн|род,ед|им,мн) A=(пр,мн,полн|вин,мн,полн,од|род,мн,полн) S,муж,неод=пр,мн S,муж,неод=(вин,мн|им,мн) S,жен,неод=род,мн V,нп=прош,мн,изъяв,сов S,сокр=(пр,мн|пр,ед|вин,мн|вин,ед|дат,мн|дат,ед|род,мн|род,ед|твор,мн|твор,ед|им,мн|им,ед) V,нп=(прош,пр,ед,прич,полн,муж,сов,действ|прош,пр,ед,прич,полн,сред,сов,действ) S,муж,неод=(дат,ед|местн,ед) S,жен,неод=(вин,ед|им,ед) A=(вин,ед,полн,муж,од|род,ед,полн,муж|род,ед,полн,сред) S,муж,од=(вин,ед|род,ед) ADV,вводн= V,нп=непрош,ед,изъяв,3-л,сов A=(дат,мн,полн|твор,ед,полн,муж|твор,ед,полн,сред) V,пе=инф,несов S,сред,неод=(вин,ед|им,ед) S,муж,од=дат,мн A=(вин,ед,полн,муж,од|род,ед,полн,муж|род,ед,полн,сред) S,муж,неод=род,ед ","избрание президент дональд трамп становиться главный событие последний три месяц уходить год несмотря негативный ожидание оно повлечь новый волна рост фондовый рынок рынок облигация снижаться в наступать год деятельность эксцентричный миллиардер вероятно становиться главный обращать внимание игрок фондовый рынок
",2017-01-14T00:00:00+03:00,Главный фактор на фондовом рынке в 2017 году,https://www.kommersant.ru/doc/3190824
28,"Kommersant, Евгений Хвостик","Министерство юстиции США и рейтинговое агентство Moody`s сообщили о достижении соглашения, в рамках которого агентство выплатит американским властям компенсации в общей сложности на $864 млн за некорректное присвоение рейтингов ипотечным ценным бумагам в преддверии ипотечного кризиса 2007 года. Завышенные рейтинги ипотечных бумаг стали одной из главных причин ипотечного кризиса, который в 2008–2009 годах вызвал мировой финансовый кризис.","S,сред,неод=(вин,ед|им,ед) S,жен,неод=(пр,ед|вин,мн|дат,ед|род,ед|им,мн) S,сокр,гео,мн,неод=(пр|вин|дат|род|твор|им) A=(вин,ед,полн,сред|им,ед,полн,сред) S,сред,неод=(вин,ед|им,ед) V,пе=прош,мн,изъяв,сов S,сред,неод=пр,ед S,сред,неод=(вин,мн|род,ед|им,мн) S,жен,неод=пр,мн APRO=(вин,ед,муж,од|род,ед,муж|род,ед,сред) S,сред,неод=(вин,ед|им,ед) V,пе=непрош,ед,изъяв,3-л,сов A=(дат,мн,полн|твор,ед,полн,муж|твор,ед,полн,сред) S,жен,неод=дат,мн S,жен,неод=(пр,ед|вин,мн|дат,ед|род,ед|им,мн) A=(пр,ед,полн,жен|дат,ед,полн,жен|род,ед,полн,жен|твор,ед,полн,жен|срав) S,жен,неод=(пр,ед|вин,мн|дат,ед|род,ед|им,мн) A=(вин,ед,полн,сред|им,ед,полн,сред) S,сред,неод=(вин,ед|им,ед) S,муж,неод=род,мн A=(дат,мн,полн|твор,ед,полн,муж|твор,ед,полн,сред) A=(дат,мн,полн|твор,ед,полн,муж|твор,ед,полн,сред) S,жен,неод=дат,мн S,сред,неод=пр,ед A=(вин,ед,полн,муж,од|род,ед,полн,муж|род,ед,полн,сред) S,муж,неод=род,ед S,муж,неод=(вин,мн|род,ед|им,мн) V=(прош,вин,мн,прич,полн,сов,страд,неод,пе|прош,им,мн,прич,полн,сов,страд,пе) S,муж,неод=(вин,мн|им,мн) A=(пр,мн,полн|вин,мн,полн,од|род,мн,полн) S,жен,неод=род,мн V,нп=прош,мн,изъяв,сов APRO=(пр,ед,жен|дат,ед,жен|род,ед,жен|твор,ед,жен) A=(пр,мн,полн|вин,мн,полн,од|род,мн,полн) S,жен,неод=род,мн A=(вин,ед,полн,муж,од|род,ед,полн,муж|род,ед,полн,сред) S,муж,неод=род,ед APRO=(вин,ед,муж,неод|им,ед,муж) S,муж,неод=пр,мн V,пе=прош,ед,изъяв,муж,сов A=(вин,ед,полн,муж,неод|им,ед,полн,муж|пр,ед,полн,жен|дат,ед,полн,жен|род,ед,полн,жен|твор,ед,полн,жен) A=(вин,ед,полн,муж,неод|им,ед,полн,муж) S,муж,неод=(вин,ед|им,ед) ","министерство юстиция сша рейтинговый агентство Moody s сообщать достижение соглашение рамка который агентство выплачивать американский власть компенсация общий сложность некорректный присвоение рейтинг ипотечный ценный бумага преддверие ипотечный кризис год завышать рейтинг ипотечный бумага становиться один главный причина ипотечный кризис который год вызывать мировой финансовый кризис
",2017-01-15T16:02:08+03:00,В рамках соглашения с Минюстом США и властями 22 штатов,https://www.kommersant.ru/doc/3193505
29,"Kommersant, Павел Аксенов","В понедельник в середине дня технический сбой заставил Московскую биржу приостановить торги в секции фондового рынка. Из-за ошибки в программном обеспечении участники рынка не могли заключать сделки на торговой площадке в течение 46 минут. Впрочем, время для форс-мажора оказалось на редкость удачным — он совпал с российским обедом и американским выходным.","S,сокр=(пр,мн|пр,ед|вин,мн|вин,ед|дат,мн|дат,ед|род,мн|род,ед|твор,мн|твор,ед|им,мн|им,ед) S,муж,неод=(вин,ед|им,ед) S,жен,неод=(пр,ед|дат,ед) S,муж,неод=род,ед A=(вин,ед,полн,муж,неод|им,ед,полн,муж) S,муж,неод=(вин,ед|им,ед) V,пе=прош,ед,изъяв,муж,сов A=вин,ед,полн,жен S,жен,неод=вин,ед V,пе=инф,сов S,мн,неод=(вин|им) S,жен,неод=(пр,ед|вин,мн|дат,ед|род,ед|им,мн) A=(вин,ед,полн,муж,од|род,ед,полн,муж|род,ед,полн,сред) S,муж,неод=род,ед S,имя,жен,од=им,ед S,жен,неод=(вин,мн|род,ед|им,мн) A=(пр,ед,полн,муж|пр,ед,полн,сред) S,сред,неод=пр,ед S,муж,од=им,мн S,муж,неод=род,ед V,несов,нп=прош,мн,изъяв V,пе=инф,несов S,жен,неод=(вин,мн|род,ед|им,мн) A=(пр,ед,полн,жен|дат,ед,полн,жен|род,ед,полн,жен|твор,ед,полн,жен) S,жен,неод=(пр,ед|дат,ед) S,сред,неод=(вин,ед|им,ед) S,жен,неод=род,мн CONJ,вводн= S,сред,неод=(вин,ед|им,ед) S,муж,неод=род,ед V,нп=прош,ед,изъяв,сред,сов S,жен,неод=(вин,ед|им,ед) A=(дат,мн,полн|твор,ед,полн,муж|твор,ед,полн,сред) V,нп=прош,ед,изъяв,муж,сов A=(дат,мн,полн|твор,ед,полн,муж|твор,ед,полн,сред) S,муж,неод=твор,ед A=(дат,мн,полн|твор,ед,полн,муж|твор,ед,полн,сред) S,муж,неод=(дат,мн|твор,ед) ","в понедельник середина день технический сбой заставлять московский биржа приостанавливать торги секция фондовый рынок изза ошибка программный обеспечение участник рынок мочь заключать сделка торговый площадка течение минута впрочем время форсмажор оказываться редкость удачный совпадать российский обед американский выходной
",2017-01-16T21:39:35+03:00,Торги на фондовом рынке были приостановлены на 46 минут,https://www.kommersant.ru/doc/3194264
30,"Kommersant, Павел Аксенов","Минтруд предлагает исключить возможность оформления заявлений граждан о переводе пенсионных накоплений с использованием электронной подписи, формируемой независимыми удостоверяющими центрами. Учитывая, что по этому каналу идет абсолютное большинство заявлений, реализация инициативы может серьезно затруднить переход ""молчунов"" в негосударственные пенсионные фонды (НПФ). Минфин и Минэкономики уже отрицательно оценили проект, однако окончательное решение остается за правительством.","S,муж,неод=(вин,ед|им,ед) V,пе=непрош,ед,изъяв,3-л,несов V,пе=инф,сов S,жен,неод=(вин,ед|им,ед) S,сред,неод=(вин,мн|род,ед|им,мн) S,сред,неод=род,мн S,муж,од=(вин,мн|род,мн) S,муж,неод=пр,ед A=(пр,мн,полн|вин,мн,полн,од|род,мн,полн) S,сред,неод=род,мн S,сред,неод=твор,ед A=(пр,ед,полн,жен|дат,ед,полн,жен|род,ед,полн,жен|твор,ед,полн,жен) S,жен,неод=(пр,ед|вин,мн|дат,ед|род,ед|им,мн) V,несов,пе=(непрош,пр,ед,прич,полн,жен,страд|непрош,дат,ед,прич,полн,жен,страд|непрош,род,ед,прич,полн,жен,страд|непрош,твор,ед,прич,полн,жен,страд) A=твор,мн,полн V,пе=непрош,твор,мн,прич,полн,несов,действ S,муж,неод=твор,мн V=непрош,деепр,несов,пе SPRO,ед,сред,неод=дат S,муж,неод=дат,ед V,несов,нп=непрош,ед,изъяв,3-л A=(вин,ед,полн,сред|им,ед,полн,сред) S,ед,сред,неод=(вин|им) S,сред,неод=род,мн S,жен,неод=им,ед S,жен,неод=(вин,мн|род,ед|им,мн) ADV= V,пе=инф,сов S,муж,неод=(вин,ед|им,ед) S,муж,од=(вин,мн|род,мн) A,полн=(им,мн|вин,мн,неод) A=(вин,мн,полн,неод|им,мн,полн) S,муж,неод=(вин,мн|им,мн) S,муж,неод=(вин,ед|им,ед) S,сред,неод=(пр,мн|пр,ед|вин,мн|вин,ед|дат,мн|дат,ед|род,мн|род,ед|твор,мн|твор,ед|им,мн|им,ед) ADV= V,пе=прош,мн,изъяв,сов S,муж,неод=(вин,ед|им,ед) CONJ= A=(вин,ед,полн,сред|им,ед,полн,сред) S,сред,неод=(вин,ед|им,ед) V,нп=непрош,ед,изъяв,3-л,несов S,сред,неод=твор,ед ","минтруд предлагать исключать возможность оформление заявление гражданин перевод пенсионный накопление использование электронный подпись формировать независимый удостоверять центр учитывать этот канал идти абсолютный большинство заявление реализация инициатива серьезно затруднять переход молчун негосударственный пенсионный фонд НПФ минфин минэкономики отрицательно оценивать проект однако окончательный решение оставаться правительство
",2017-01-16T00:00:00+03:00,Минтруд хочет затруднить гражданам перевод пенсионных средств,https://www.kommersant.ru/doc/3193584
31,"Kommersant, Анна Макеева","Российские студенты лишились доступа к образовательным кредитам с государственной поддержкой. О приостановке кредитования на специальных условиях объявил единственный выдававший такие займы банк — Сбербанк, объяснив это оптимизацией государственной программы. В Минобрнауки заявили, что выдача кредитов заморожена из-за необходимости привести в соответствие с новыми требованиями правительства документы, а сокращение финансирования программы не планируется.","A=(вин,мн,полн,неод|им,мн,полн) S,муж,од=им,мн V,нп=прош,мн,изъяв,сов S,муж,неод=род,ед A=(дат,мн,полн|твор,ед,полн,муж|твор,ед,полн,сред) S,муж,неод=дат,мн A=(пр,ед,полн,жен|дат,ед,полн,жен|род,ед,полн,жен|твор,ед,полн,жен) S,жен,неод=твор,ед INTJ= S,жен,неод=(пр,ед|дат,ед) S,сред,неод=(вин,мн|род,ед|им,мн) A=(пр,мн,полн|вин,мн,полн,од|род,мн,полн) S,сред,неод=пр,мн V,пе=прош,ед,изъяв,муж,сов A=(вин,ед,полн,муж,неод|им,ед,полн,муж) V,пе=(прош,вин,ед,прич,полн,муж,несов,действ,неод|прош,им,ед,прич,полн,муж,несов,действ) APRO=(им,мн|вин,мн,неод) S,муж,неод=(вин,мн|им,мн) S,муж,неод=(вин,ед|им,ед) S,муж,неод=(вин,ед|им,ед) V,пе=прош,деепр,сов S,жен,неод=твор,ед A=(пр,ед,полн,жен|дат,ед,полн,жен|род,ед,полн,жен|твор,ед,полн,жен) S,жен,неод=(вин,мн|род,ед|им,мн) S,сокр=(пр,мн|пр,ед|вин,мн|вин,ед|дат,мн|дат,ед|род,мн|род,ед|твор,мн|твор,ед|им,мн|им,ед) S,жен,неод=(вин,мн|род,ед|им,мн) V,пе=прош,мн,изъяв,сов S,жен,неод=им,ед S,муж,неод=род,мн V=прош,ед,прич,кр,жен,сов,страд,пе S,имя,жен,од=им,ед S,жен,неод=(пр,ед|вин,мн|дат,ед|род,ед|им,мн) V=инф,сов S,сред,неод=(вин,ед|им,ед) A=твор,мн,полн S,сред,неод=твор,мн S,сред,неод=(вин,мн|род,ед|им,мн) S,муж,неод=(вин,мн|им,мн) S,сред,неод=(вин,ед|им,ед) S,сред,неод=(вин,мн|род,ед|им,мн) S,жен,неод=(вин,мн|род,ед|им,мн) V,несов,нп=непрош,ед,изъяв,3-л ","российский студент лишаться доступ образовательный кредит государственный поддержка о приостановка кредитование специальный условие объявлять единственный выдавать такой заем банк сбербанк объяснять оптимизация государственный программа в минобрнаука заявлять выдача кредит замораживать изза необходимость приводить соответствие новый требование правительство документ сокращение финансирование программа планироваться
",2017-01-16T00:00:00+03:00,Сбербанк приостановил программу образовательных кредитов,https://www.kommersant.ru/doc/3193611
32,"Kommersant, Юлия Полякова","Основной бенефициар микрофинансовой организации (МФО) ""Домашние деньги"" Евгений Бернштам ищет инвестора среди банков и даже готов расстаться с контролем в компании, сообщили источники ""Ъ"". ""Домашние деньги"" нуждаются как в финансировании текущей деятельности, так и в капитальном финансировании — для выполнения ужесточаемых требований ЦБ по резервам. Господин Бернштам эту информацию опровергает.","A=(вин,ед,полн,муж,неод|им,ед,полн,муж|пр,ед,полн,жен|дат,ед,полн,жен|род,ед,полн,жен|твор,ед,полн,жен) S,муж,од=им,ед A,полн=(пр,ед,жен|дат,ед,жен|род,ед,жен|твор,ед,жен) S,жен,неод=(пр,ед|вин,мн|дат,ед|род,ед|им,мн) S,сокр=(пр,мн|пр,ед|вин,мн|вин,ед|дат,мн|дат,ед|род,мн|род,ед|твор,мн|твор,ед|им,мн|им,ед) S,мн,од=им S,мн,неод=(вин|им) S,имя,муж,од=им,ед S,фам,муж,од=им,ед V,несов,пе=непрош,ед,изъяв,3-л S,муж,од=(вин,ед|род,ед) PR= S,муж,неод=род,мн A=ед,кр,муж V,нп=инф,сов S,муж,неод=твор,ед S,жен,неод=(пр,ед|вин,мн|дат,ед|род,ед|им,мн) V,пе=прош,мн,изъяв,сов S,муж,неод=(вин,мн|им,мн) S,мн,од=им S,мн,неод=(вин|им) V,несов,нп=непрош,мн,изъяв,3-л S,сред,неод=пр,ед A=(пр,ед,полн,жен|дат,ед,полн,жен|род,ед,полн,жен|твор,ед,полн,жен|срав) S,жен,неод=(пр,ед|вин,мн|дат,ед|род,ед|им,мн) A=(пр,ед,полн,муж|пр,ед,полн,сред) S,сред,неод=пр,ед S,сред,неод=(вин,мн|род,ед|им,мн) V,несов,пе=(непрош,пр,мн,прич,полн,страд|непрош,вин,мн,прич,полн,страд,од|непрош,род,мн,прич,полн,страд) S,сред,неод=род,мн S,сред,неод=(пр,мн|пр,ед|вин,мн|вин,ед|дат,мн|дат,ед|род,мн|род,ед|твор,мн|твор,ед|им,мн|им,ед) S,муж,неод=дат,мн S,муж,од=им,ед S,фам,муж,од=им,ед S,жен,неод=вин,ед V,пе=непрош,ед,изъяв,3-л,несов ","основной бенефициар микрофинансовый организация мфо домашние деньги евгений бернштам искать инвестор среди банк готовый расставаться контроль компания сообщать источник Ъ домашние деньги нуждаться финансирование текущий деятельность капитальный финансирование выполнение ужесточать требование цб резерв господин бернштам информация опровергать
",2017-01-16T00:00:00+03:00,Инвесторам предлагают контроль над компанией,https://www.kommersant.ru/doc/3193595
