,Authors,Lead sentences,Lemm Analysis,Lemmatized lead sentences,Publish Date,Title,URL
80,"Kommersant, Юлия Полякова, Юлия Локшина, Дмитрий Козлов","В тройку финальных претендентов на приобретение принадлежащих Внешэкономбанку (ВЭБ) ""Глобэкса"" и Связь-банка вошла одна из компаний группы ""Роснефти"". Она подала соответствующую заявку и дошла до финала. Решение о том, кому продать банки, госкорпорация примет в середине февраля, но эксперты считают шансы ""Роснефти"" крайне высокими. Нефтяная компания уже имеет банк — ВБРР, в случае покупки ""дочек"" ВЭБа банковские активы группы могут быть объединены.","S,сокр=(пр,мн|пр,ед|вин,мн|вин,ед|дат,мн|дат,ед|род,мн|род,ед|твор,мн|твор,ед|им,мн|им,ед) S,жен,неод=вин,ед A=(пр,мн,полн|вин,мн,полн,од|род,мн,полн) S,муж,од=(вин,мн|род,мн) S,сред,неод=(вин,ед|им,ед) V,несов,нп=(непрош,пр,мн,прич,полн,действ|непрош,род,мн,прич,полн,действ|непрош,вин,мн,прич,полн,действ,од) S,муж,неод=дат,ед S,муж,неод=(вин,ед|им,ед) S,муж,неод=род,ед S,жен,од=им,ед V,нп=прош,ед,изъяв,жен,сов APRO=им,ед,жен S,жен,неод=род,мн S,жен,неод=(вин,мн|род,ед|им,мн) S,ед,жен,неод=(пр|дат|род) SPRO,ед,3-л,жен=им V,пе=прош,ед,изъяв,жен,сов A=вин,ед,полн,жен S,жен,неод=вин,ед V,нп=прош,ед,изъяв,жен,сов S,муж,неод=род,ед S,сред,неод=(вин,ед|им,ед) SPRO,ед,муж,од=дат V,пе=инф,сов S,муж,неод=(вин,мн|им,мн) S,жен,неод=им,ед V=непрош,ед,изъяв,3-л,сов S,жен,неод=(пр,ед|дат,ед) S,муж,неод=род,ед S,муж,од=им,мн V,несов,пе=непрош,мн,изъяв,3-л S,муж,неод=(вин,мн|им,мн) S,ед,жен,неод=(пр|дат|род) ADV= A=твор,мн,полн A=им,ед,полн,жен S,жен,неод=им,ед V,несов,пе=непрош,ед,изъяв,3-л S,муж,неод=(вин,ед|им,ед) S,муж,неод=пр,ед S,жен,неод=(вин,мн|род,ед|им,мн) S,жен,од=(вин,мн|род,мн) S,муж,неод=род,ед A=(вин,мн,полн,неод|им,мн,полн) S,муж,неод=(вин,мн|им,мн) S,жен,неод=(вин,мн|род,ед|им,мн) V,несов,нп=непрош,мн,изъяв,3-л V,пе=прош,мн,прич,кр,сов,страд ","в тройка финальный претендент приобретение принадлежать внешэкономбанк вэб глобэкс связьбанк входить один компания группа роснефть она подавать соответствующий заявка доходить финал решение кто продавать банка госкорпорация принимать середина февраль эксперт считать шанс роснефть крайне высокий нефтяной компания иметь банк ВБРР случай покупка дочка вэб банковский актив группа мочь объединять
",2017-01-25T00:00:00+03:00,"Компания может купить банковские ""дочки"" ВЭБа",https://www.kommersant.ru/doc/3200950
81,"Kommersant, Павел Аксенов, Юлия Локшина, Виталий Гайдаев, Ксения Дементьева, Юлия Полякова","Как стало известно ""Ъ"", ФГКУ ""Росвоенипотека"" возглавит бывший первый заместитель гендиректора Агентства по ипотечному жилищному кредитованию (АИЖК) Андрей Семенюк. На этом посту он сменит Владимира Шумилина. Коллективу нового руководителя представят на следующей неделе. По словам источников ""Ъ"", цель кадровых перестановок — повышение качества работы учреждения.","ADVPRO= V,нп=прош,ед,изъяв,сред,сов ADV,прдк= S,сред,неод=(пр,мн|пр,ед|вин,мн|вин,ед|дат,мн|дат,ед|род,мн|род,ед|твор,мн|твор,ед|им,мн|им,ед) S,жен,неод=им,ед V,пе=непрош,ед,изъяв,3-л,сов A,полн=(вин,ед,муж,неод|им,ед,муж) ANUM=(вин,ед,муж,неод|им,ед,муж) S,муж,од=им,ед S,муж,од=(вин,ед|род,ед|им,мн) S,сред,неод=(вин,мн|род,ед|им,мн) A=(дат,ед,полн,муж|дат,ед,полн,сред) A=(дат,ед,полн,муж|дат,ед,полн,сред) S,сред,неод=дат,ед S,муж,неод=(пр,мн|пр,ед|вин,мн|вин,ед|дат,мн|дат,ед|род,мн|род,ед|твор,мн|твор,ед|им,мн|им,ед) S,имя,муж,од=им,ед S,фам,муж,од=им,ед PR= S,муж,неод=(дат,ед|местн,ед) V,сов,пе=непрош,ед,изъяв,3-л S,имя,муж,од=(вин,ед|род,ед) S,фам,муж,од=(вин,ед|род,ед) S,муж,неод=дат,ед S,сред,неод=род,ед S,муж,од=(вин,ед|род,ед) V,пе=непрош,мн,изъяв,3-л,сов A=(пр,ед,полн,жен|дат,ед,полн,жен|род,ед,полн,жен|твор,ед,полн,жен) S,жен,неод=(пр,ед|дат,ед) PR= S,сред,неод=дат,мн S,муж,неод=род,мн S,жен,неод=(вин,ед|им,ед) A=(пр,мн,полн|вин,мн,полн,од|род,мн,полн) S,жен,неод=род,мн S,сред,неод=(вин,ед|им,ед) S,сред,неод=(вин,мн|род,ед|им,мн) S,жен,неод=(вин,мн|род,ед|им,мн) S,сред,неод=(вин,мн|род,ед|им,мн) ","как становиться известно Ъ фгку росвоенипотека возглавлять бывший первый заместитель гендиректор агентство ипотечный жилищный кредитование аижк андрей семенюк на пост сменить владимир шумилин коллектив новый руководитель представлять следующий неделя по слово источник Ъ цель кадровый перестановка повышение качество работа учреждение
",2017-01-25T00:00:00+03:00,Учреждение возглавит бывший первый замгендиректора агентства,https://www.kommersant.ru/doc/3200882
82,"Kommersant, Юлия Локшина","Незадолго перед присоединением к банку ""Восточный"" ""Юниаструм"" лишился 17% вкладов, став рекордсменом по оттоку средств розничных клиентов в декабре 2016 года. Во многом эта ситуация связана с уходом дорогих депозитов, привлеченных в конце 2015 года. Чтобы компенсировать отток ликвидности, банку пришлось дважды повышать ставки в декабре 2016 — январе 2017 года.","ADV= S,сред,неод=твор,ед S,жен,неод=вин,ед A=(вин,ед,полн,муж,неод|им,ед,полн,муж) S,муж,неод=(вин,ед|им,ед) V,нп=прош,ед,изъяв,муж,сов S,муж,неод=род,мн V,нп=прош,деепр,сов S,муж,од=твор,ед S,муж,неод=дат,ед S,сред,неод=род,мн A=(пр,мн,полн|вин,мн,полн,од|род,мн,полн) S,муж,од=(вин,мн|род,мн) S,муж,неод=пр,ед S,муж,неод=(вин,мн|род,ед|им,мн) PART= SPRO,ед,сред=пр APRO=им,ед,жен S,жен,неод=им,ед A=ед,кр,жен S,муж,неод=твор,ед A=(пр,мн,полн|вин,мн,полн,од|род,мн,полн) S,муж,неод=род,мн V=(прош,пр,мн,прич,полн,сов,страд|прош,вин,мн,прич,полн,сов,страд,од|прош,род,мн,прич,полн,сов,страд) S,муж,неод=пр,ед S,муж,неод=(вин,мн|род,ед|им,мн) CONJ= V,пе=(инф,несов|инф,сов) S,муж,неод=(вин,ед|им,ед) S,жен,неод=(пр,ед|вин,мн|дат,ед|род,ед|им,мн) S,жен,неод=вин,ед V,нп=прош,ед,изъяв,сред,сов ADV= V=инф,несов,пе S,жен,неод=(вин,мн|род,ед|им,мн) S,муж,неод=пр,ед S,муж,неод=пр,ед S,муж,неод=(вин,мн|род,ед|им,мн) ","незадолго присоединение банка восточный юниаструм лишаться вклад становиться рекордсмен отток средство розничный клиент декабрь год во многое этот ситуация связанный уход дорогой депозит привлекать конец год чтобы компенсировать отток ликвидность банка приходиться дважды повышать ставка декабрь январь год
",2017-01-25T00:00:00+03:00,"Перед присоединением к ""Восточному"" банк ""Юниаструм"" потерял 17% розничных депозитов",https://www.kommersant.ru/doc/3200880
83,"Kommersant, Мария Сарычева, Павел Аксенов","Московская биржа исключила из высшего котировального списка облигации тринадцати эмитентов — уровень кредитных рейтингов этих бумаг не соответствовал требованиям листинга. Одновременно облигации перестали соответствовать регуляторным требованиям, необходимым для инвестирования средств негосударственных пенсионных фондов. В результате крупнейшие НПФ должны решать, как реализовать бумаги на 100 млрд руб.","A=им,ед,полн,жен S,жен,неод=им,ед V,пе=прош,ед,изъяв,жен,сов A=(вин,ед,полн,прев,муж,од|род,ед,полн,прев,муж|род,ед,полн,прев,сред) A,полн=(вин,ед,муж,од|род,ед,муж|род,ед,сред) S,муж,неод=род,ед S,жен,неод=(пр,ед|вин,мн|дат,ед|род,ед|им,мн) NUM=(пр|дат|род) S,муж,од=(вин,мн|род,мн) S,муж,неод=(вин,ед|им,ед) A=(пр,мн,полн|вин,мн,полн,од|род,мн,полн) S,муж,неод=род,мн APRO=(пр,мн|род,мн|вин,мн,од) S,жен,неод=род,мн V,несов,нп=прош,ед,изъяв,муж S,сред,неод=дат,мн S,муж,неод=род,ед ADV= S,жен,неод=(пр,ед|вин,мн|дат,ед|род,ед|им,мн) V,нп=прош,мн,изъяв,сов V,несов,нп=инф A,полн=(дат,мн|твор,ед,муж|твор,ед,сред) S,сред,неод=дат,мн A=(дат,мн,полн|твор,ед,полн,муж|твор,ед,полн,сред) S,сред,неод=(вин,мн|род,ед|им,мн) S,сред,неод=род,мн A,полн=(пр,мн|род,мн|вин,мн,од) A=(пр,мн,полн|вин,мн,полн,од|род,мн,полн) S,муж,неод=род,мн S,сокр=(пр,мн|пр,ед|вин,мн|вин,ед|дат,мн|дат,ед|род,мн|род,ед|твор,мн|твор,ед|им,мн|им,ед) S,муж,неод=пр,ед A=(вин,мн,полн,прев,неод|им,мн,полн,прев) A=мн,кр V,пе=инф,несов V=инф,сов S,жен,неод=(вин,мн|род,ед|им,мн) ","московский биржа исключать высокий котировальный список облигация тринадцать эмитент уровень кредитный рейтинг этот бумага соответствовать требование листинг одновременно облигация переставать соответствовать регуляторный требование необходимый инвестирование средство негосударственный пенсионный фонд в результат крупный НПФ должный решать реализовать бумага
",2017-01-25T00:00:00+03:00,Инвестиции НПФ на 100 млрд руб. перестали соответствовать требованиям регулятора,https://www.kommersant.ru/doc/3200877
84,"Kommersant, Мария Сарычева","В 2016 году увеличился объем активов, хранящихся на счетах в Национальном расчетном депозитарии (НРД). Наибольший рост показали иностранные ценные бумаги — их объем увеличился почти вдвое. Значительно выросли также объемы выпусков облигаций, а также ОФЗ на счетах иностранных номинальных держателей.","S,сокр=(пр,мн|пр,ед|вин,мн|вин,ед|дат,мн|дат,ед|род,мн|род,ед|твор,мн|твор,ед|им,мн|им,ед) S,муж,неод=(дат,ед|местн,ед) V,нп=прош,ед,изъяв,муж,сов S,муж,неод=(вин,ед|им,ед) S,муж,неод=род,мн V,несов,нп=(непрош,пр,мн,прич,полн,действ|непрош,род,мн,прич,полн,действ|непрош,вин,мн,прич,полн,действ,од) S,муж,неод=пр,мн A=(пр,ед,полн,муж|пр,ед,полн,сред) A=(пр,ед,полн,муж|пр,ед,полн,сред) S,муж,неод=(пр,ед|вин,мн|им,мн) A=(вин,ед,полн,прев,муж,неод|им,ед,полн,прев,муж) S,муж,неод=(вин,ед|им,ед) V=прош,мн,изъяв,сов A=(вин,мн,полн,неод|им,мн,полн) A=(вин,мн,полн,неод|им,мн,полн) S,жен,неод=(вин,мн|род,ед|им,мн) S,муж,неод=(вин,ед|им,ед) V,нп=прош,ед,изъяв,муж,сов ADV= ADV= V,нп=прош,мн,изъяв,сов ADV= S,муж,неод=(вин,мн|им,мн) S,муж,неод=род,мн S,жен,неод=род,мн ADV= S,муж,неод=пр,мн A=(пр,мн,полн|вин,мн,полн,од|род,мн,полн) A=(пр,мн,полн|вин,мн,полн,од|род,мн,полн) S,муж,од=(вин,мн|род,мн) ","в год увеличиваться объем актив храниться счет национальный расчетный депозитарий НРД большой рост показывать иностранный ценный бумага объем увеличиваться вдвое значительно вырастать также объем выпуск облигация также ОФЗ счет иностранный номинальный держатель
",2017-01-25T00:00:00+03:00,Фондовый рынок,https://www.kommersant.ru/doc/3200863
85,"Kommersant, Евгений Хвостик","Голландское управлению по контролю за финансовыми рынками непреднамеренно опубликовало информацию о коротких позициях нескольких крупных инвестфондов, работающих в стране, в том числе инвестфонда Джорджа Сороса. Власти уже принесли извинения за случившееся.","A=(вин,ед,полн,сред|им,ед,полн,сред) S,сред,неод=дат,ед S,муж,неод=дат,ед A=твор,мн,полн S,муж,неод=твор,мн ADV= V=прош,ед,изъяв,сред,сов S,жен,неод=вин,ед A=(пр,мн,полн|вин,мн,полн,од|род,мн,полн) S,жен,неод=пр,мн NUM=(|пр|род|вин,од) A=(пр,мн,полн|вин,мн,полн,од|род,мн,полн) S,муж,неод=род,мн V,несов,нп=(непрош,пр,мн,прич,полн,действ|непрош,род,мн,прич,полн,действ|непрош,вин,мн,прич,полн,действ,од) S,жен,неод=(пр,ед|дат,ед) S,сред,неод=пр,ед S,муж,неод=род,ед S,имя,муж,од=(вин,ед|род,ед) S,фам,муж,од=(вин,ед|род,ед) S,жен,неод=(пр,ед|вин,мн|дат,ед|род,ед|им,мн) V=прош,мн,изъяв,сов S,сред,неод=(вин,мн|род,ед|им,мн) V,нп=(прош,вин,ед,прич,полн,сред,сов,действ|прош,им,ед,прич,полн,сред,сов,действ) ","голландский управление контроль финансовый рынок непреднамеренно опубликовывать информация короткий позиция несколько крупный инвестфонд работать страна число инвестфонд джордж сорос власть приносить извинение случаться
",2017-01-26T16:26:37+03:00,Регулятор по ошибке выпустил информацию о коротких позициях нескольких инвестфондов,https://www.kommersant.ru/doc/3201890
86,"Kommersant, Яна Рождественская","Консалтинговая компания EY сообщила о том, что китайские инвестиции в европейские компании выросли в 2016 году почти в три раза, до $85,8 млрд. Особенно заметно выросли инвестиции в Германию — за год почти в 24 раза до $12,6 млрд. По мнению экспертов, Германия становится основным направлением для китайских инвестиций в Европе, этому помимо всего прочего способствует Brexit и избрание Дональда Трампа.","A=им,ед,полн,жен S,жен,неод=им,ед V,пе=прош,ед,изъяв,жен,сов A=(вин,мн,полн,неод|им,мн,полн) S,жен,неод=(пр,ед|вин,мн|дат,ед|род,ед|им,мн) A=(вин,мн,полн,неод|им,мн,полн) S,жен,неод=(пр,ед|вин,мн|дат,ед|род,ед|им,мн) V,нп=прош,мн,изъяв,сов S,муж,неод=(дат,ед|местн,ед) S,муж,неод=род,ед ADV= ADV= V,нп=прош,мн,изъяв,сов S,жен,неод=(пр,ед|вин,мн|дат,ед|род,ед|им,мн) S,гео,жен,неод=вин,ед S,муж,неод=(вин,ед|им,ед) S,муж,неод=род,ед PR= S,сред,неод=дат,ед S,муж,од=(вин,мн|род,мн) S,гео,жен,неод=им,ед V,нп=непрош,ед,изъяв,3-л,несов A=(дат,мн,полн|твор,ед,полн,муж|твор,ед,полн,сред) S,сред,неод=твор,ед A=(пр,мн,полн|вин,мн,полн,од|род,мн,полн) S,жен,неод=род,мн S,гео,жен,неод=(пр,ед|дат,ед) SPRO,ед,сред,неод=дат PR= A,полн=(вин,ед,муж,од|род,ед,муж|род,ед,сред) V,несов,нп=непрош,ед,изъяв,3-л S,сред,неод=(вин,ед|им,ед) S,имя,муж,од=(вин,ед|род,ед) S,муж,неод=род,ед ","консалтинговый компания EY сообщать китайский инвестиция европейский компания вырастать год раз особенно заметный вырастать инвестиция германия год раз по мнение эксперт германия становиться основной направление китайский инвестиция европа этот помимо прочее способствовать Brexit избрание дональд трамп
",2017-01-26T15:21:56+03:00,В 2016 году они утроились — до $86 млрд,https://www.kommersant.ru/doc/3201876
87,"Kommersant, Вероника Горячева","Банк России определился, кого и как он планирует регулировать на рынке аудита. В рамках расширения своих полномочий ЦБ разработал поправки к закону ""Об аудиторской деятельности"" и направил их на согласование в Минфин. Аудиторы считают, что для начала ЦБ взял на себя слишком много полномочий, и надеются на смягчение проекта.","S,муж,неод=(вин,ед|им,ед) S,гео,жен,неод=(пр,ед|вин,мн|дат,ед|род,ед|им,мн) V,нп=прош,ед,изъяв,муж,сов SPRO,ед,муж,од=(вин|род) V,несов,пе=непрош,ед,изъяв,3-л V,несов,пе=инф S,муж,неод=пр,ед S,муж,неод=род,ед S,сокр=(пр,мн|пр,ед|вин,мн|вин,ед|дат,мн|дат,ед|род,мн|род,ед|твор,мн|твор,ед|им,мн|им,ед) S,жен,неод=пр,мн S,сред,неод=(вин,мн|род,ед|им,мн) APRO=(пр,мн|род,мн|вин,мн,од) S,сред,неод=род,мн S,сред,неод=(пр,мн|пр,ед|вин,мн|вин,ед|дат,мн|дат,ед|род,мн|род,ед|твор,мн|твор,ед|им,мн|им,ед) V,пе=прош,ед,изъяв,муж,сов S,жен,неод=(вин,мн|род,ед|им,мн) S,муж,неод=дат,ед PR= A=(пр,ед,полн,жен|дат,ед,полн,жен|род,ед,полн,жен|твор,ед,полн,жен) S,жен,неод=(пр,ед|вин,мн|дат,ед|род,ед|им,мн) V,пе=прош,ед,изъяв,муж,сов S,сред,неод=(вин,ед|им,ед) S,муж,неод=(вин,ед|им,ед) S,муж,од=им,мн V,несов,пе=непрош,мн,изъяв,3-л V,пе=прош,ед,изъяв,жен,сов S,сред,неод=(пр,мн|пр,ед|вин,мн|вин,ед|дат,мн|дат,ед|род,мн|род,ед|твор,мн|твор,ед|им,мн|им,ед) V,сов,пе=прош,ед,изъяв,муж ADV= S,сред,неод=род,мн V,несов,нп=непрош,мн,изъяв,3-л S,сред,неод=(вин,ед|им,ед) S,муж,неод=род,ед ","банк россия определяться кто планировать регулировать рынок аудит в рамка расширение свой полномочие цб разрабатывать поправка закон об аудиторский деятельность направлять согласование минфин аудитор считать начало цб взять слишком полномочие надеяться смягчение проект
",2017-01-26T00:00:00+03:00,Регулятор осваивается на новом рынке,https://www.kommersant.ru/doc/3201577
